{
  "schema_version": "1.0",
  "publication_id": "test_002_approved",
  "domain": "test_domain",
  "canonical_commit": "def5678",
  "package_hash": "sha256:aaaaaaaaaaaaaaaaaaaaaaaaaaaaaaaaaaaaaaaaaaaaaaaaaaaaaaaaaaaaaaaa",
  "status": "FOUNDER_APPROVED_FOR_LAUNCH",
  "publish_at": "2026-08-10T14:00:00Z",
  "assets": [
    {
      "id": "asset_002",
      "path": "assets/article.md",
      "sha256": "1111111111111111111111111111111111111111111111111111111111111111",
      "media_type": "text/markdown"
    },
    {
      "id": "asset_003",
      "path": "assets/featured_image.png",
      "sha256": "2222222222222222222222222222222222222222222222222222222222222222",
      "media_type": "image/png",
      "alt_text": "Featured image for article"
    }
  ],
  "destinations": [
    {
      "destination_id": "tao.wordpress.production",
      "payload_ref": "payload_wp_tao"
    },
    {
      "destination_id": "tao.brevo.production",
      "payload_ref": "payload_email_tao"
    }
  ],
  "qa": {
    "passed": true,
    "checked_at": "2026-08-09T18:00:00Z",
    "notes": ["All checks passed", "Ready for founder approval"]
  }
}
